{
  "slug": "cloudland-pastures",
  "title": "Cloudland Pastures",
  "location": "Cloudland, GA",
  "acres_label": "101± Acres",
  "price_label": "$1,100,000",
  "status": "Under Contract",
  "hero_image": {
    "src": "http://127.0.0.1:8766/assets/hero-image.png",
    "alt": "Cloudland Pastures — aerial view"
  },
  "intro_paragraphs": [
    "Cloudland Pastures is a picturesque 101± acre working homestead on Lookout Mountain in northwest Georgia. The land unfolds across gently rolling pastureland framed by wooded edges that provide both privacy and natural beauty.",
    "A 2,350± square foot farmhouse with a recently painted exterior and newer roof sits on a hill overlooking the property. The home includes two bedrooms and two baths, along with a living room, office, and mud room.",
    "With frontage along both Alabama Highway 103 and Golf Course Road, access to the property is convenient and straightforward."
  ],
  "brokers": [
    {
      "name": "Elliott Davenport, Jr",
      "title": "Land Broker",
      "photo": "https://www.wingsgroupllc.com/wp-content/uploads/2022/05/Elliott_Davenport-500x647.jpg",
      "phone": "423-364-2092",
      "phone_tel": "+14233642092",
      "email": "elliott@wingsgroupllc.com",
      "about_url": "https://www.wingsgroupllc.com/about-us/#elliott-davenport,-jr",
      "about_label": "About Elliott"
    },
    {
      "name": "Shit Head",
      "title": "Master Shitter",
      "photo": "https://www.wingsgroupllc.com/wp-content/uploads/2022/05/Elliott_Davenport-500x647.jpg",
      "phone": "423-364-2092",
      "phone_tel": "+14233642092",
      "email": "elliott@wingsgroupllc.com",
      "about_url": "https://www.wingsgroupllc.com/about-us/#elliott-davenport,-jr",
      "about_label": "About SHITTER"
    }
  ],
  "brokers_comment": "With rolling pastures, three ponds, and a hilltop farmhouse, Cloudland Pastures is a versatile mountain property that’s immediately usable and well located near Mentone, Chattanooga, and McLemore.",
  "executive_assistance": [
    "Randy Marsh"
  ],
  "gallery_images": [
    {
      "src": "https://www.wingsgroupllc.com/wp-content/uploads/2025/12/CLP-1002.jpg",
      "alt": "Pasture view"
    },
    {
      "src": "https://www.wingsgroupllc.com/wp-content/uploads/2025/12/CLP-1003.jpg",
      "alt": "Pond"
    },
    {
      "src": "https://www.wingsgroupllc.com/wp-content/uploads/2025/12/CLP-1004.jpg",
      "alt": "Barn"
    },
    {
      "src": "https://www.wingsgroupllc.com/wp-content/uploads/2025/12/CLP-1005.jpg",
      "alt": "Fields"
    },
    {
      "src": "https://www.wingsgroupllc.com/wp-content/uploads/2025/12/CLP-1006.jpg",
      "alt": "Homestead"
    },
    {
      "src": "https://www.wingsgroupllc.com/wp-content/uploads/2025/12/CLP-1007.jpg",
      "alt": "Fence line"
    }
  ],
  "facts": [
    "Picturesque 101± acre working homestead in northwest Georgia, well-suited for horses or cattle, small-scale agriculture, or recreational use",
    "Beautiful landscape offers distant mountain views and gently rolling pastures lined and wooded edges",
    "Located in Cloudland, GA on Lookout Mountain in Chattooga County",
    "3± acre fishing and livestock pond and two additional smaller ponds",
    "2,350± sq. ft. farmhouse with a recently painted exterior and newer roof, 2 bedrooms and 2 baths",
    "Barn measuring approximately 120 ft x 125 ft with both open and enclosed storage and working pens for livestock"
  ],
  "map_embed_url": "https://id.land/maps/d05960d404d00306d98c8d42453569a4/embed",
  "downloads": [
    {
      "title": "Map Package - Cloudland Pastures",
      "href": "https://www.wingsgroupllc.com/wp-content/uploads/2025/12/Map-Package-CP.pdf",
      "thumb": "https://www.wingsgroupllc.com/wp-content/uploads/2025/12/Map-Package-CP-pdf.jpg"
    }
  ],
  "detail_tabs": [
    {
      "label": "Location",
      "images": [
        {
          "src": "https://www.wingsgroupllc.com/wp-content/uploads/2025/12/Location-CloudlandPastures-1.jpg",
          "alt": "Location map"
        }
      ],
      "paragraphs": [
        "Located on Lookout Mountain in Chattooga County, Georgia, with frontage along Alabama Highway 103 and Golf Course Road."
      ]
    }
  ]
}
