{
  "slug": "oak-hollow-sample",
  "title": "Oak Hollow",
  "location": "Sample County, TN",
  "acres_label": "45± Acres",
  "price_label": "$595,000",
  "status": "Available",
  "hero_image": {
    "src": "https://images.unsplash.com/photo-1500382017468-9049fed747ef?w=2400&q=80",
    "alt": "Rolling fields at dawn"
  },
  "intro_paragraphs": [
    "Oak Hollow is a sample listing used to prove the template. Replace this JSON with your own property data.",
    "Add as many paragraphs as you need; each array entry becomes a `<p>` in the intro column."
  ],
  "brokers": [
    {
      "name": "Jane Agent",
      "title": "Broker",
      "photo": "https://images.unsplash.com/photo-1573496359142-b8d87734a5a2?w=500&h=647&fit=crop",
      "about_url": "#",
      "about_label": "Bio",
      "phone": "555-0100",
      "phone_tel": "+15550100",
      "email": "jane@example.com"
    },
    {
      "name": "Alex Partner",
      "title": "Associate Broker",
      "photo": "https://images.unsplash.com/photo-1560250097-0b93528c311a?w=500&h=647&fit=crop",
      "about_url": "#",
      "about_label": "Bio",
      "phone": "555-0101",
      "phone_tel": "+15550101",
      "email": "alex@example.com"
    }
  ],
  "brokers_comment": null,
  "executive_assistance": [
    "Jane Agent",
    "Alex Partner",
    "Pat Lee"
  ],
  "gallery_images": [
    { "src": "https://images.unsplash.com/photo-1469474968028-56623f02e42e?w=1200&q=80", "alt": "Woods" },
    { "src": "https://images.unsplash.com/photo-1441974231531-c6227db76b6e?w=1200&q=80", "alt": "Forest path" }
  ],
  "facts": [
    "Mixed hardwoods and open meadow",
    "County road frontage",
    "No structures; blank slate for build site"
  ],
  "map_embed_url": null,
  "downloads": [],
  "detail_tabs": [
    {
      "label": "Overview",
      "images": [],
      "paragraphs": ["Placeholder tab content. Add tabs in `detail_tabs` for Location, Soils, etc."]
    }
  ]
}
